{
  "schema_id": "schema_v1_staff",
  "schema_version": "1.0.0",
  "timestamp": "2026-05-06T20:30:00+08:00",
  "org_id": "org_automage_mvp",
  "department_id": "dept_mvp_core",
  "user_id": "user_agent_001",
  "node_id": "staff_agent_huwentao_001",
  "record_date": "2026-05-06",
  "task_progress": [
    {
      "task_id": "TASK-20260506-AGENT-001",
      "task_title": "将 Staff 日报模板接入 Staff Agent 输入解析",
      "today_result": "已完成表单字段到 schema_v1_staff 的解析映射，生成 Staff payload 样例。",
      "previous_status": "in_progress",
      "current_status": "completed",
      "completion_percent": 100,
      "need_follow_up": true,
      "remark": "后续需要替换真实 API 调用并与数据库 Skill 联调。"
    },
    {
      "task_id": "TASK-20260506-AGENT-002",
      "task_title": "跑通 Manager 读取 Staff 日报并生成汇总",
      "today_result": "本地 mock 链路已可读取 Staff payload 并输出 Manager 汇总样例。",
      "previous_status": "pending",
      "current_status": "in_progress",
      "completion_percent": 80,
      "need_follow_up": true,
      "remark": "等待真实数据库 Skill 读写验证。"
    }
  ],
  "work_progress": [
    {
      "item_id": "WP-STAFF-NORMAL-001",
      "title": "Agent prompt 第一版落地",
      "item_type": "prompt",
      "description": "完成 Staff、Manager、Executive、Base Agent 的第一版 prompt，明确角色、权限边界、可用 Skills 与触发行为。",
      "status": "completed",
      "evidence": "automage_agents/templates/base/agents.md；automage_agents/templates/line_worker/agents.md；automage_agents/templates/manager/agents.md；automage_agents/templates/executive/agents.md",
      "artifact_ids": [
        "ART-AGENT-PROMPT-V1"
      ],
      "artifact_links": [
        "repo://automage_agents/templates"
      ],
      "related_module": "Agent 客制化 / Prompt",
      "available_for_integration": true
    },
    {
      "item_id": "WP-STAFF-NORMAL-002",
      "title": "Context 结构 v0 接入本地 Mock Demo",
      "item_type": "context",
      "description": "新增 RuntimeContextV0，并接入 SkillContext、Agent 初始化、日报提交、Manager 汇总和 Executive 决策链路。",
      "status": "completed",
      "evidence": "本地 demo 可携带 org_id、user_id、node_id、dag_run_id、run_date 运行。",
      "artifact_ids": [
        "ART-CONTEXT-V0"
      ],
      "artifact_links": [
        "repo://automage_agents/context/runtime_context_v0.py"
      ],
      "related_module": "Agent 编排 / Context",
      "available_for_integration": true
    },
    {
      "item_id": "WP-STAFF-NORMAL-003",
      "title": "本地 Mock Demo 主链路跑通",
      "item_type": "test",
      "description": "覆盖 Staff 日报、Manager 读取日报、Manager 汇总、Executive 决策、老板确认、任务生成、Staff 查询任务。",
      "status": "completed",
      "evidence": "run_mock_workflow.py 可读取 mock JSON 并输出 workflow 验证结果。",
      "artifact_ids": [
        "ART-MOCK-WORKFLOW-V1"
      ],
      "artifact_links": [
        "file://run_mock_workflow.py"
      ],
      "related_module": "Mock Workflow / 联调",
      "available_for_integration": true
    }
  ],
  "issues_faced": [
    {
      "issue_id": "ISSUE-STAFF-NORMAL-001",
      "issue_title": "Mock 字段与真实数据库字段仍需最终对齐",
      "description": "当前 Mock Demo 使用 Schema JSON 作为契约，真实数据库中存在 staff_reports / manager_reports / decision_records 等新表，需要数据库 Agent 继续做字段映射确认。",
      "impact_scope": "里程碑二可继续，里程碑三真实联调前需冻结映射。",
      "severity": "medium",
      "is_blocking": false,
      "need_support_from": "熊锦文 / 杨卓"
    }
  ],
  "solution_attempt": [
    {
      "solution_id": "SOL-STAFF-NORMAL-001",
      "issue_id": "ISSUE-STAFF-NORMAL-001",
      "description": "在 Mock 数据 meta 中同时记录推荐接口、推荐表、兼容表和字段映射策略，便于后续数据库核查。",
      "result": "Mock 闭环不依赖真实数据库即可先跑通，后续由数据库对齐报告回修。",
      "status": "effective"
    }
  ],
  "need_support": false,
  "support_detail": "",
  "need_decision": false,
  "decision_detail": "",
  "next_day_plan": [
    {
      "plan_id": "PLAN-STAFF-NORMAL-001",
      "title": "将本地 Mock Demo 替换为数据库 Skill 调用",
      "description": "优先替换 Staff 日报提交、Manager 读取日报、任务查询三段链路。",
      "priority": "high",
      "expected_output": "真实 API 接入版 demo，至少完成 Staff 写入验证。",
      "related_task_id": "TASK-20260507-AGENT-001"
    },
    {
      "plan_id": "PLAN-STAFF-NORMAL-002",
      "title": "补充 Agent 侧错误处理与重试策略",
      "description": "覆盖 401、403、409、422、5xx 和网络超时。",
      "priority": "medium",
      "expected_output": "Agent 错误处理策略说明与 mock 用例。",
      "related_task_id": "TASK-20260507-AGENT-002"
    }
  ],
  "resource_usage": {
    "work_hours": 8.5,
    "tools": [
      "OpenClaw/Hermes Agent 模板",
      "Python Mock Workflow",
      "JSON Schema",
      "本地文件系统"
    ],
    "budget": 0,
    "materials": [
      "Staff 日报模板 v1.0.0",
      "Schema JSON 文件",
      "DAG 节点-接口-数据表映射表"
    ],
    "other": "当前为本地 Mock 验证，暂未依赖真实数据库写入。"
  },
  "artifacts": [
    {
      "artifact_id": "ART-AGENT-PROMPT-V1",
      "artifact_type": "prompt",
      "title": "三级 Agent prompt 第一版",
      "description": "Staff / Manager / Executive / Base Agent 模板说明。",
      "url": "repo://automage_agents/templates",
      "storage_type": "local_path",
      "version": "v0.1.0",
      "meta": {
        "owner": "胡文涛"
      }
    },
    {
      "artifact_id": "ART-MOCK-WORKFLOW-V1",
      "artifact_type": "code",
      "title": "run_mock_workflow.py",
      "description": "本地 Mock 闭环验证脚本。",
      "url": "file://run_mock_workflow.py",
      "storage_type": "local_path",
      "version": "v1.0.0",
      "meta": {
        "milestone": "M2"
      }
    }
  ],
  "related_task_ids": [
    "TASK-20260506-AGENT-001",
    "TASK-20260506-AGENT-002"
  ],
  "risk_level": "low",
  "employee_comment": "当前本地 Mock 链路可继续支撑里程碑二验证，真实数据库对齐后需要回修字段映射。",
  "signature": {
    "confirm_status": "confirmed",
    "signed_by": "user_agent_001",
    "signed_by_role": "staff_agent_owner",
    "signed_at": "2026-05-06T20:30:00+08:00",
    "signature_method": "manual_confirm",
    "payload_hash": "sha256:bd593c60b286c639245bea17983a1ef86ce696f984be93ce0e2f8bc6662fe335",
    "signature_value": "mock_signature_d786b5fdabb2",
    "comment": "MVP Mock 数据确认"
  },
  "meta": {
    "mock_case": "normal",
    "milestone": "M2",
    "api_endpoint": "POST /api/v1/report/staff",
    "recommended_write_tables": [
      "staff_reports",
      "work_records",
      "work_record_items",
      "artifacts",
      "audit_logs"
    ],
    "compatible_design_tables": [
      "work_records",
      "work_record_items",
      "artifacts",
      "audit_logs"
    ],
    "runtime_context": {
      "dag_run_id": "DAGRUN-20260506-AUTOMAGE-M2-001",
      "run_date": "2026-05-06",
      "tenant_id": "org_automage_mvp",
      "channel": "mock_local"
    },
    "db_mapping_strategy": "Staff 原始日报可落 staff_reports；结构化字段拆分可兼容落 work_records / work_record_items；产出物落 artifacts；审计落 audit_logs。"
  }
}
