{
  "schema_id": "schema_v1_staff",
  "schema_version": "1.0.0",
  "timestamp": "2026-05-06T20:30:00+08:00",
  "org_id": "org_automage_mvp",
  "department_id": "dept_mvp_core",
  "user_id": "user_backend_001",
  "node_id": "staff_agent_xiongjinwen_001",
  "record_date": "2026-05-06",
  "task_progress": [
    {
      "task_id": "TASK-20260506-BACKEND-001",
      "task_title": "上线 PostgreSQL 数据库并冻结数据表口径",
      "today_result": "数据库可通过 182.92.93.16:5432 连接，public schema 已有 28 张业务表，包含 staff_reports、manager_reports、decision_records、tasks、audit_logs 等。",
      "previous_status": "in_progress",
      "current_status": "completed",
      "completion_percent": 100,
      "need_follow_up": true,
      "remark": "需要继续确认核心 CRUD API 和数据库 Skill 是否可被 Agent 稳定调用。"
    },
    {
      "task_id": "TASK-20260506-BACKEND-002",
      "task_title": "核心 CRUD API 与数据库 Skill 交付测试",
      "today_result": "数据库可连，但 API / Skill 端到端写入 Staff → Manager → Executive → Task 尚未完成验证。",
      "previous_status": "pending",
      "current_status": "blocked",
      "completion_percent": 40,
      "need_follow_up": true,
      "blocked_reason": "缺少已验证的数据库 Skill 调用样例和 API 访问结果。",
      "remark": "阻塞真实联调，不阻塞本地 Mock 闭环。"
    }
  ],
  "work_progress": [
    {
      "item_id": "WP-STAFF-HIGHRISK-001",
      "title": "真实数据库结构初步探测完成",
      "item_type": "database",
      "description": "确认 PostgreSQL 15.17 可连接，public schema 有 28 张表，已具备业务结构和少量测试数据。",
      "status": "completed",
      "evidence": "Node pg 客户端连接与查询成功；pg_stat_user_tables 有行数估计。",
      "artifact_ids": [
        "ART-DB-PROBE-001"
      ],
      "artifact_links": [
        "db://182.92.93.16:5432/automage"
      ],
      "related_module": "数据库 / 后端事实源",
      "available_for_integration": true
    },
    {
      "item_id": "WP-STAFF-HIGHRISK-002",
      "title": "主链路 API 契约补齐",
      "item_type": "api",
      "description": "补齐 agent/init、report/staff、report/manager、decision/commit、tasks、incidents、dream/run 等主链路接口口径。",
      "status": "in_progress",
      "evidence": "接口契约文档初版，待真实调用测试。",
      "artifact_ids": [
        "ART-API-CONTRACT-V1"
      ],
      "artifact_links": [
        "file://openapi.automage_mvp.yaml"
      ],
      "related_module": "API / 后端",
      "available_for_integration": false
    }
  ],
  "issues_faced": [
    {
      "issue_id": "ISSUE-STAFF-HIGHRISK-001",
      "issue_title": "数据库可连但 API / Skill 端到端链路未验证",
      "description": "里程碑二后半段需要将本地 mock demo 替换为真实数据库 Skill 和 API 调用；当前缺少 Staff 写入、Manager 读取、任务查询的真实调用结果。",
      "impact_scope": "阻塞里程碑三真实联调；不阻塞里程碑二本地 Mock 闭环。",
      "severity": "high",
      "is_blocking": true,
      "need_support_from": "熊锦文 / 胡文涛"
    },
    {
      "issue_id": "ISSUE-STAFF-HIGHRISK-002",
      "issue_title": "真实库表结构与里程碑一落库口径存在新增表差异",
      "description": "真实库增加 staff_reports、manager_reports、decision_records、decision_logs、task_queue、agent_profiles、agent_sessions、external_identities 等表，需要明确它们与 work_records、summaries、tasks、audit_logs 的关系。",
      "impact_scope": "影响 Mock 字段到真实数据库的映射表和后续 API 落库实现。",
      "severity": "medium",
      "is_blocking": false,
      "need_support_from": "杨卓 / 熊锦文"
    }
  ],
  "solution_attempt": [
    {
      "solution_id": "SOL-STAFF-HIGHRISK-001",
      "issue_id": "ISSUE-STAFF-HIGHRISK-001",
      "description": "先保留本地 Mock 闭环作为里程碑二验收底座，同时要求数据库 Agent 生成数据库结构核查与 Mock 映射报告。",
      "result": "可避免里程碑二被真实后端阻塞，同时为里程碑三联调提供差异清单。",
      "status": "pending_verify"
    }
  ],
  "need_support": true,
  "support_detail": "需要后端提供可调用的 Staff 日报提交、Manager 读取日报、任务查询三个最小 API 或数据库 Skill 样例；需要 Agent 侧验证 Skill 读写返回格式。",
  "need_decision": true,
  "decision_detail": "是否将里程碑二验收标准分为“本地 Mock 闭环必过”和“真实数据库 API 联调作为里程碑三入口条件”，避免数据库 Skill 未完全可用时阻塞 Mock 验收。",
  "next_day_plan": [
    {
      "plan_id": "PLAN-STAFF-HIGHRISK-001",
      "title": "完成数据库 Skill 最小读写验证",
      "description": "提供 Staff 写入、Manager 查询、Task 查询三条可复现调用样例。",
      "priority": "critical",
      "expected_output": "Skill 读写验证记录和可调用示例。",
      "related_task_id": "TASK-20260507-BACKEND-001"
    },
    {
      "plan_id": "PLAN-STAFF-HIGHRISK-002",
      "title": "冻结真实库与里程碑一契约差异处理策略",
      "description": "明确 staff_reports/work_records、manager_reports/summaries、decision_records/summaries.meta、task_queue/tasks 的主从关系。",
      "priority": "high",
      "expected_output": "数据库联调建议与字段映射表。",
      "related_task_id": "TASK-20260507-BACKEND-002"
    }
  ],
  "resource_usage": {
    "work_hours": 9.0,
    "tools": [
      "PostgreSQL 15.17",
      "Node pg 客户端",
      "OpenAPI 契约",
      "数据库 DDL / ER 图"
    ],
    "budget": 0,
    "materials": [
      "15业务表DDL.sql",
      "真实数据库表结构",
      "DAG 节点-接口-数据表映射表"
    ],
    "other": "真实数据库疑似 Docker 容器部署，服务端地址 172.17.0.2:5432。"
  },
  "artifacts": [
    {
      "artifact_id": "ART-DB-PROBE-001",
      "artifact_type": "table",
      "title": "真实数据库连接与表清单探测结果",
      "description": "PostgreSQL 15.17，public schema 28 张业务表。",
      "url": "db://182.92.93.16:5432/automage",
      "storage_type": "url",
      "version": "probe-20260506",
      "meta": {
        "table_count": 28,
        "db_name": "automage"
      }
    }
  ],
  "related_task_ids": [
    "TASK-20260506-BACKEND-001",
    "TASK-20260506-BACKEND-002"
  ],
  "risk_level": "high",
  "employee_comment": "数据库本体已可连接，但真实 API / Skill 端到端链路仍需作为次日最高优先级处理。",
  "signature": {
    "confirm_status": "confirmed",
    "signed_by": "user_backend_001",
    "signed_by_role": "backend_owner",
    "signed_at": "2026-05-06T20:30:00+08:00",
    "signature_method": "manual_confirm",
    "payload_hash": "sha256:43b7ad27712fe8de893566608393d6c1397961018ff144515d4f48caa10aac15",
    "signature_value": "mock_signature_59305e68f3b6",
    "comment": "MVP Mock 数据确认"
  },
  "meta": {
    "mock_case": "high_risk",
    "milestone": "M2",
    "api_endpoint": "POST /api/v1/report/staff",
    "recommended_write_tables": [
      "staff_reports",
      "work_records",
      "work_record_items",
      "incidents",
      "artifacts",
      "audit_logs"
    ],
    "compatible_design_tables": [
      "work_records",
      "work_record_items",
      "incidents",
      "audit_logs"
    ],
    "runtime_context": {
      "dag_run_id": "DAGRUN-20260506-AUTOMAGE-M2-001",
      "run_date": "2026-05-06",
      "tenant_id": "org_automage_mvp",
      "channel": "mock_local"
    },
    "incident_candidates": [
      "ISSUE-STAFF-HIGHRISK-001"
    ],
    "db_mapping_strategy": "高风险日报进入 staff_reports / work_records；阻塞项可转换为 incidents；需要老板决策的问题由 Manager 汇总上推。"
  }
}
